{
  "schema_version": 1,
  "mission": {
    "id": "MIS-001",
    "title": "Audit de configuration interne",
    "description": "Revue des paramètres de diagnostic et de la bannière de l’application interne.",
    "scope": ["intranet.example"]
  },
  "evidence": [
    {
      "id": "E-001",
      "path": "evidence/configuration.txt",
      "sha256": "821ce65fea65e873803390058858bf4c0b647eeb17a74397ee7b9f74b348ff0c",
      "description": "Synthetic configuration for demonstrating a review workflow.",
      "source": "Original Argos synthetic fixture; no target or real user data."
    },
    {
      "id": "E-002",
      "path": "evidence/banner.txt",
      "sha256": "29f3cce70d629012f6ad39ba7b335603f35951d70d866f487a67f761ddb2fe2d",
      "description": "Synthetic application banner for a documentation review.",
      "source": "Original Argos synthetic fixture; no target or real user data."
    }
  ],
  "findings": [
    {
      "id": "F-001",
      "title": "Configuration de diagnostic",
      "severity": "low",
      "asset": "intranet.example",
      "description": "Le fichier de configuration déclare un mode diagnostic. Son contexte et ses paramètres doivent être examinés.",
      "recommendation": "Vérifier le contexte et documenter la configuration retenue.",
      "evidence_ids": ["E-001"],
      "review": null
    },
    {
      "id": "F-002",
      "title": "Bannière applicative",
      "severity": "info",
      "asset": "intranet.example",
      "description": "La bannière présente l’application comme un environnement de formation. Vérifier la clarté de ce libellé pour les utilisateurs.",
      "recommendation": "Préciser l’usage de l’environnement dans la bannière.",
      "evidence_ids": ["E-002"],
      "review": null
    }
  ]
}
